{
  "schemaVersion": "1.0.0",
  "graphId": "grafting.fixture.minimal",
  "sourceRevision": "workspace:sha256:0000000000000000000000000000000000000000000000000000000000000000",
  "generator": {
    "id": "extractor:graph-ir-fixture",
    "version": "1.0.0",
    "inputHash": "1111111111111111111111111111111111111111111111111111111111111111"
  },
  "nodes": [
    {
      "id": "project:architecture-studio",
      "kind": "project",
      "authorityClass": "canonical_authored_source",
      "level": "L0",
      "label": "Architecture Studio",
      "tags": ["scope:knowledge", "type:app"],
      "provenance": {
        "extractor": {
          "id": "extractor:graph-ir-fixture",
          "version": "1.0.0"
        },
        "sourceRevision": "workspace:sha256:0000000000000000000000000000000000000000000000000000000000000000",
        "confidence": 1,
        "evidence": [
          {
            "kind": "manifest",
            "path": "apps/architecture-studio/project.json",
            "pointer": "/metadata/graphIr",
            "sha256": "2222222222222222222222222222222222222222222222222222222222222222"
          }
        ]
      }
    },
    {
      "id": "project:graph-core",
      "kind": "project",
      "authorityClass": "canonical_authored_source",
      "level": "L0",
      "label": "Rust graph core",
      "tags": ["scope:shared", "type:lib"],
      "provenance": {
        "extractor": {
          "id": "extractor:graph-ir-fixture",
          "version": "1.0.0"
        },
        "sourceRevision": "workspace:sha256:0000000000000000000000000000000000000000000000000000000000000000",
        "confidence": 1,
        "evidence": [
          {
            "kind": "manual",
            "path": "libs/graph/core/project.json",
            "pointer": "/metadata/graphIr",
            "sha256": "3333333333333333333333333333333333333333333333333333333333333333"
          }
        ]
      }
    }
  ],
  "edges": [
    {
      "id": "edge:project%3Aarchitecture-studio--depends_on--project%3Agraph-core",
      "kind": "depends_on",
      "source": "project:architecture-studio",
      "target": "project:graph-core",
      "relationClass": "declared",
      "provenance": {
        "extractor": {
          "id": "extractor:graph-ir-fixture",
          "version": "1.0.0"
        },
        "sourceRevision": "workspace:sha256:0000000000000000000000000000000000000000000000000000000000000000",
        "confidence": 1,
        "evidence": [
          {
            "kind": "manifest",
            "path": "apps/architecture-studio/project.json",
            "pointer": "/implicitDependencies",
            "sha256": "2222222222222222222222222222222222222222222222222222222222222222"
          }
        ]
      }
    }
  ]
}
